{
  "$schema": "https://json-schema.org/draft/2020-12/schema",
  "$id": "https://samsarix.com/schemas/creative-spirals/campaign-v1.schema.json",
  "title": "Samsarix Creative Spirals campaign",
  "description": "One approved source draft and its requested social-platform outputs.",
  "type": "object",
  "additionalProperties": false,
  "required": ["schemaVersion", "name", "body", "platforms"],
  "properties": {
    "schemaVersion": {
      "const": 1,
      "description": "Campaign configuration schema version."
    },
    "name": {
      "type": "string",
      "minLength": 1,
      "maxLength": 120,
      "pattern": "^[^\\r\\n]*$"
    },
    "title": {
      "type": "string",
      "minLength": 1,
      "maxLength": 200,
      "pattern": "^[^\\r\\n]*$"
    },
    "body": {
      "type": "string",
      "minLength": 1,
      "maxLength": 100000
    },
    "link": {
      "type": "string",
      "format": "uri",
      "maxLength": 500,
      "pattern": "^https?://\\S+$"
    },
    "hashtags": {
      "type": "array",
      "maxItems": 10,
      "uniqueItems": true,
      "items": {
        "type": "string",
        "minLength": 1,
        "maxLength": 51,
        "description": "Optional leading # followed by letters, numbers, or underscores; runtime validation is Unicode-aware."
      },
      "default": []
    },
    "platforms": {
      "type": "array",
      "minItems": 1,
      "maxItems": 3,
      "uniqueItems": true,
      "items": {
        "enum": ["x", "linkedin", "discord"]
      }
    }
  }
}
